{
  "id": "ADR-0002",
  "type": "ADR",
  "status": "Accepted",
  "version": "0.1.0",
  "owners": [
    "APES Maintainers"
  ],
  "depends_on": [
    "ADR-0001",
    "SRC-025",
    "SRC-026",
    "SRC-053",
    "SRC-054"
  ],
  "supersedes": [],
  "evidence": [
    "SRC-025",
    "SRC-026",
    "SRC-053",
    "SRC-054"
  ],
  "last_updated": "2026-08-07"
}
